{
  "type": "object",
  "properties": {
    "schema_version": {
      "const": 1
    },
    "bundle_id": {
      "type": "string",
      "pattern": "^[A-Za-z0-9][A-Za-z0-9_.-]{0,127}$"
    },
    "bundle_kind": {
      "const": "analysis"
    },
    "status": {
      "enum": [
        "succeeded",
        "failed",
        "cancelled"
      ]
    },
    "created_at": {
      "type": "string",
      "format": "date-time"
    },
    "files": {
      "type": "array",
      "items": {
        "type": "object",
        "properties": {
          "path": {
            "type": "string"
          },
          "sha256": {
            "type": "string",
            "pattern": "^[0-9a-f]{64}$"
          },
          "size_bytes": {
            "type": "integer",
            "minimum": 0
          }
        },
        "required": [
          "path",
          "sha256",
          "size_bytes"
        ],
        "additionalProperties": false
      }
    },
    "metadata": {
      "type": "object",
      "properties": {
        "analysis_id": {
          "type": "string",
          "pattern": "^[A-Za-z0-9][A-Za-z0-9_.-]{0,127}$"
        },
        "analysis_path": {
          "type": "string"
        },
        "input_fingerprints": {
          "type": "array",
          "items": {
            "type": "string",
            "pattern": "^[0-9a-f]{64}$"
          }
        },
        "phases": {
          "type": "array",
          "items": {
            "enum": [
              "fixture",
              "development",
              "final"
            ]
          }
        },
        "analyzer_identity": {
          "type": "object"
        }
      },
      "required": [
        "analysis_id",
        "analysis_path",
        "input_fingerprints",
        "phases",
        "analyzer_identity"
      ],
      "additionalProperties": false
    }
  },
  "required": [
    "schema_version",
    "bundle_id",
    "bundle_kind",
    "status",
    "created_at",
    "files",
    "metadata"
  ],
  "additionalProperties": false,
  "$schema": "https://json-schema.org/draft/2020-12/schema",
  "$id": "https://researchflow.local/v1/analysis_manifest.json"
}
