{"bundle_id":"A-finish-search-001-fb4c7e0bdcdce6e35b83b6b1","bundle_kind":"analysis","created_at":"2026-10-25T20:15:04.816575+00:00","files":[{"path":"analysis.json","sha256":"ba6381d9465b5e11ca1378896478b5de28d7c69914b8c4741cf3917673510763","size_bytes":199136},{"path":"analysis_config.json","sha256":"e9e7eacb07400a1a3897d577a3ac11536721432d14f0495d2de9068f567c6ef0","size_bytes":12979},{"path":"inputs/R-finish-search-001/manifest.json","sha256":"e9c30cb81743061d32e174031d7b4acea32582fa7d6c8a131ad1bc2b33070a64","size_bytes":58263},{"path":"inputs/R-finish-search-001/result.json","sha256":"0af829bf7c57653d7158ea70b4f7640703987ff1bbb6209d3052990437204209","size_bytes":64485},{"path":"per_query/P20_all.jsonl","sha256":"7d69dbb0c8d6e62281f3f10130c93c7ca2bcb1333ef31994952e227aae725128","size_bytes":7361165},{"path":"per_query/P20_decay.jsonl","sha256":"480f8a51bc4ca57597895863082685b209f7034804725fe4b5925392cc60ed6c","size_bytes":7360758},{"path":"per_query/P20_decay_popularity.jsonl","sha256":"2d5e0dd27df5424a2234bb13b774cf1aae84328d7224bce2452859403717e44a","size_bytes":7448884},{"path":"per_query/P20_forward.jsonl","sha256":"7ec74306042916a349df8221322e74cb891ffea003d3b0f6c6d37bf969270bb0","size_bytes":7361071},{"path":"per_query/P20_manual.jsonl","sha256":"a4dfdd2445692b6c9e1a7a0f1ea91fabb19f9f4e8483a052e60325118f2e76d8","size_bytes":7361543},{"path":"per_query/P20_no_pair.jsonl","sha256":"b5634c9df346f9c44a776b399697603e5b8a0b32ce044689c23a0c103c287fce","size_bytes":7438164},{"path":"per_query/P20_original.jsonl","sha256":"1a63a66318991c21d7745e65b4f82373f67a30a72b95fd1475b6cdfb2884ab0f","size_bytes":7363448},{"path":"per_query/P20_personal_frequency.jsonl","sha256":"70acf3dbc0f8bdb4c2a6189e70af737bbfa9e40113954d9d0c000aa5fe3e3445","size_bytes":7387938},{"path":"per_query/P20_popularity.jsonl","sha256":"a628ba0e72a1f61e92a25667cddec9b151ed361b926643f6dfa076571db963bc","size_bytes":7426748},{"path":"per_query/P20_random.jsonl","sha256":"aadcec991134f8697044042a4e435c136bc88c4a71fadf586fb44fbde63a6f46","size_bytes":7418385},{"path":"per_query/P20_random_search.jsonl","sha256":"7ec74306042916a349df8221322e74cb891ffea003d3b0f6c6d37bf969270bb0","size_bytes":7361071},{"path":"per_query/P20_recency_rule.jsonl","sha256":"53c41b76d73118738f8252bdbcf79bdc99aa88f3cae77dbe9850a54ff0f27ed2","size_bytes":7370524},{"path":"per_query/U20_all.jsonl","sha256":"310fdbba5f6922cfe954a5e29c1739538d949d9a12786a4aa7684a9526a85e45","size_bytes":7334031},{"path":"per_query/U20_decay.jsonl","sha256":"fee1dad1c614cbde835f4d6fb838378060a1acff19e906ce66f8358ce8952dd4","size_bytes":7334010},{"path":"per_query/U20_decay_popularity.jsonl","sha256":"8a47002dfb559e509d69835a0a0af5d4e208705c432f981dd026404a17dd05dc","size_bytes":7400660},{"path":"per_query/U20_forward_frozen.jsonl","sha256":"c18d501d0b2079a18dcc792c8c6c32f9821828346d27d64a00706f5772a499e9","size_bytes":7333909},{"path":"per_query/U20_manual.jsonl","sha256":"dd9795f5403e45e574ce0e0eeb11a62ed0d7ddd361d650de0c2755cb2905025c","size_bytes":7334219},{"path":"per_query/U20_no_pair.jsonl","sha256":"a151e57f23edbc737b38248300babd21c98539cd1aa357a5a1a4a2d0012cf0a7","size_bytes":7402141},{"path":"per_query/U20_original.jsonl","sha256":"83b7140ad5a0de7b593ead144a7676e0679a50240167635236801a330ee44941","size_bytes":7334215},{"path":"per_query/U20_personal_frequency.jsonl","sha256":"822219530577be4854932944d7399b3b9e0999533148c62c5815a4efb9dd6cf2","size_bytes":7334644},{"path":"per_query/U20_popularity.jsonl","sha256":"184d87f1dfb50983ef567ee5f791e168a2a8b6926d09aa0558be009177d7196e","size_bytes":7413625},{"path":"per_query/U20_random.jsonl","sha256":"c860ca2dfce8ad4f9ca3cf4dc81efadd806bd61b212e081c51e54940eacf8245","size_bytes":7418830},{"path":"per_query/U20_random_search_frozen.jsonl","sha256":"c18d501d0b2079a18dcc792c8c6c32f9821828346d27d64a00706f5772a499e9","size_bytes":7333909},{"path":"per_query/U20_recency_rule.jsonl","sha256":"19c92a4fbfb7fb4049e6f6065aa5447217ece442f7d6e39c64a7885d3d4c36c5","size_bytes":7337026},{"path":"report.md","sha256":"a6a223ad5cb7f821982dfcb482c4014f13d777e9ab7a4fac0020c695f04af7cf","size_bytes":2640},{"path":"selection.json","sha256":"539ff2f8b5e0a6ee1d51c1fd9e1bee5fbdfddb77551f6f1a68d9344099e34ddd","size_bytes":376},{"path":"tables/comparisons.json","sha256":"1891a57bf87d6f66c94bd6c410fbb4955b9ccb4c56b4f52c81fa29dd392f1382","size_bytes":29843},{"path":"tables/metrics.json","sha256":"2fe2f3a0de857d6bef7d7b8bc97ed2a5b395bd687b37d298b66fb8511950be9f","size_bytes":112880}],"metadata":{"analysis_id":"A-finish-search-001","analysis_path":"analysis.json","analyzer_identity":{"code_sha256":"b1b32ff715b5a72ae3613551f9450397aa95c0fa63032a64b403aaff5643441a","command":[],"engine":"ranking","files":[{"path":"researchflow/ranking.py","sha256":"b3713666dfd0485a15dfcf8813cbd5b1bbbee238249934ffdf1601c2d0efc138"},{"path":"researchflow/analysis.py","sha256":"9968ddefee7c631c2cbffb7b3f5bb293aa9fd10ee81b39ba52b6f192e759254c"}],"input_digest":"fb4c7e0bdcdce6e35b83b6b104deceba025afd2a6b0d07f492d7516ac55fef25","numpy_version":"2.5.4"},"input_fingerprints":["e9c30cb81743061d32e174031d7b4acea32582fa7d6c8a131ad1bc2b33070a64"],"phases":["development"]},"schema_version":1,"status":"succeeded"}