{"bundle_id":"A-baseline-coldstart-f953bf0aea2b-3766dc542739d101bdb8226a","bundle_kind":"analysis","created_at":"2026-10-25T17:40:01.835786+00:00","files":[{"path":"analysis.json","sha256":"375e71e470389815811dbd6d47dece7c715dae7f82a4f2c8489572aacf6b9634","size_bytes":80031},{"path":"analysis_config.json","sha256":"dfc1094f73dd995d122782ceaf93b26f09a9edcb54bbe191c70ecbc83fc26104","size_bytes":3687},{"path":"inputs/R-baseline-20261025T173713Z-b753c781/manifest.json","sha256":"3f3d601e182b842a658a7a8952ba292d459a9fdf9ec7c79f55e10b87d45252d2","size_bytes":34241},{"path":"inputs/R-baseline-20261025T173713Z-b753c781/result.json","sha256":"46b5096964a37da43086476fb8b1ec913547c351af9726f0b0f384bf22b67a41","size_bytes":26344},{"path":"per_query/P20_no_pair.jsonl","sha256":"6805f3e1de906953b1c62bce026c2b98c4355631105ab575a66ff97e2fa4ae6d","size_bytes":1851173},{"path":"per_query/P20_original.jsonl","sha256":"84e2dcc99fec5e699d7aafd4622090f0e81de34be943a332a4a8563b85566aef","size_bytes":1837677},{"path":"per_query/P20_popularity.jsonl","sha256":"439f09b638b60c3cc1ed7ffb10afb972d5898863135287bf5c6d0fd4950d99e7","size_bytes":1852673},{"path":"per_query/P20_random.jsonl","sha256":"b16a6f97f4794fb6c68e400f3e13958189b93d0a92efe2b72d65d80740526b97","size_bytes":1848966},{"path":"per_query/P20_recency_rule.jsonl","sha256":"77e0e8071f0108f7bed849dd47579065e7d0917f2aa9efc68529ae5bf02ada95","size_bytes":1839668},{"path":"per_query/U20_no_pair.jsonl","sha256":"c78d6052e037f6e566819d9b490cd203bb1953b9dad161571544074f327fe298","size_bytes":1852270},{"path":"per_query/U20_original.jsonl","sha256":"10ff0592b2ca6fe4689206ae05cde41204285e378115d0d517070dbe64dccfa9","size_bytes":1831587},{"path":"per_query/U20_popularity.jsonl","sha256":"cc8af2686af5901be790e4d83cfdf5011b093b00f6324a16cb2cc684a0a2ac51","size_bytes":1854908},{"path":"per_query/U20_random.jsonl","sha256":"7911b7de15a2c9c1dc78f9d65769d3680e23bb82b6877d12c0e0b4cbbce21029","size_bytes":1849671},{"path":"per_query/U20_recency_rule.jsonl","sha256":"af93d383d4925e96b55920a019104a4a0a83cc6fa163e168b77bd88c7f731c7c","size_bytes":1833029},{"path":"report.md","sha256":"295d5f8b0764fd482a588244f2e1fe0ea3bcd40e936e06979054416d1826535d","size_bytes":1857},{"path":"selection.json","sha256":"f454dbc1231f973f8e7dbbc1fd666bb4787b2e52ab0cc0df3df29884965b92fa","size_bytes":350},{"path":"tables/comparisons.json","sha256":"2fa8221a2b1d720f998204f20a2d4159ae72779596eddc84c0b085fb270d9984","size_bytes":6755},{"path":"tables/metrics.json","sha256":"50718e0a8be7aa159c9d3262ee4d250c0776d25e28136d480eeb225dc596d88d","size_bytes":46621}],"metadata":{"analysis_id":"A-baseline-coldstart-f953bf0aea2b","analysis_path":"analysis.json","analyzer_identity":{"code_sha256":"b1b32ff715b5a72ae3613551f9450397aa95c0fa63032a64b403aaff5643441a","command":[],"engine":"ranking","files":[{"path":"researchflow/ranking.py","sha256":"b3713666dfd0485a15dfcf8813cbd5b1bbbee238249934ffdf1601c2d0efc138"},{"path":"researchflow/analysis.py","sha256":"9968ddefee7c631c2cbffb7b3f5bb293aa9fd10ee81b39ba52b6f192e759254c"}],"input_digest":"3766dc542739d101bdb8226a4a475ed062323c55ae29498291e8eb2d5d053257","numpy_version":"2.5.4"},"input_fingerprints":["3f3d601e182b842a658a7a8952ba292d459a9fdf9ec7c79f55e10b87d45252d2"],"phases":["development"]},"schema_version":1,"status":"succeeded"}