{"bundle_id":"A-baseline-baseline-001-b6528bb29a8f4eb8b9a1c468","bundle_kind":"analysis","created_at":"2026-10-25T16:38:59.102406+00:00","files":[{"path":"analysis.json","sha256":"a7a9083150c3114a114f558650ee921646b6b4e10758c1325fdc4a0c0d275c7c","size_bytes":79304},{"path":"analysis_config.json","sha256":"d5789692de028a18f57067514a9d3206939237a274bf08d73184f47e0956a236","size_bytes":3490},{"path":"inputs/R-warmup-anchor-001/manifest.json","sha256":"c44b425ee16a134ff62c007928d64bf9991025f8e08d5e1d27f6ef71553ec17f","size_bytes":31560},{"path":"inputs/R-warmup-anchor-001/result.json","sha256":"82176a60999b43b40b20e4e886e640b388c2db719187818b42d12299eec42bcf","size_bytes":26596},{"path":"per_query/P20_no_pair.jsonl","sha256":"6805f3e1de906953b1c62bce026c2b98c4355631105ab575a66ff97e2fa4ae6d","size_bytes":1851173},{"path":"per_query/P20_original.jsonl","sha256":"84e2dcc99fec5e699d7aafd4622090f0e81de34be943a332a4a8563b85566aef","size_bytes":1837677},{"path":"per_query/P20_popularity.jsonl","sha256":"439f09b638b60c3cc1ed7ffb10afb972d5898863135287bf5c6d0fd4950d99e7","size_bytes":1852673},{"path":"per_query/P20_random.jsonl","sha256":"b16a6f97f4794fb6c68e400f3e13958189b93d0a92efe2b72d65d80740526b97","size_bytes":1848966},{"path":"per_query/P20_recency_rule.jsonl","sha256":"77e0e8071f0108f7bed849dd47579065e7d0917f2aa9efc68529ae5bf02ada95","size_bytes":1839668},{"path":"per_query/U20_no_pair.jsonl","sha256":"c78d6052e037f6e566819d9b490cd203bb1953b9dad161571544074f327fe298","size_bytes":1852270},{"path":"per_query/U20_original.jsonl","sha256":"10ff0592b2ca6fe4689206ae05cde41204285e378115d0d517070dbe64dccfa9","size_bytes":1831587},{"path":"per_query/U20_popularity.jsonl","sha256":"cc8af2686af5901be790e4d83cfdf5011b093b00f6324a16cb2cc684a0a2ac51","size_bytes":1854908},{"path":"per_query/U20_random.jsonl","sha256":"7911b7de15a2c9c1dc78f9d65769d3680e23bb82b6877d12c0e0b4cbbce21029","size_bytes":1849671},{"path":"per_query/U20_recency_rule.jsonl","sha256":"af93d383d4925e96b55920a019104a4a0a83cc6fa163e168b77bd88c7f731c7c","size_bytes":1833029},{"path":"report.md","sha256":"b238aa063dae1cc66219a170aec29a4b8c08615c29d3cf4a2537a0a25899728a","size_bytes":1745},{"path":"selection.json","sha256":"9c61815b6e51540931d7b6a2ea4886d5ef190b0d39cab2c9da41d9acc72d0eaf","size_bytes":373},{"path":"tables/comparisons.json","sha256":"2fa8221a2b1d720f998204f20a2d4159ae72779596eddc84c0b085fb270d9984","size_bytes":6755},{"path":"tables/metrics.json","sha256":"50718e0a8be7aa159c9d3262ee4d250c0776d25e28136d480eeb225dc596d88d","size_bytes":46621}],"metadata":{"analysis_id":"A-baseline-baseline-001","analysis_path":"analysis.json","analyzer_identity":{"code_sha256":"b1b32ff715b5a72ae3613551f9450397aa95c0fa63032a64b403aaff5643441a","command":[],"engine":"ranking","files":[{"path":"researchflow/ranking.py","sha256":"b3713666dfd0485a15dfcf8813cbd5b1bbbee238249934ffdf1601c2d0efc138"},{"path":"researchflow/analysis.py","sha256":"9968ddefee7c631c2cbffb7b3f5bb293aa9fd10ee81b39ba52b6f192e759254c"}],"input_digest":"b6528bb29a8f4eb8b9a1c468c151078f15536d0658492f1aa48439ac3358c85c","numpy_version":"2.5.4"},"input_fingerprints":["c44b425ee16a134ff62c007928d64bf9991025f8e08d5e1d27f6ef71553ec17f"],"phases":["development"]},"schema_version":1,"status":"succeeded"}