{
  "schema_version": 1,
  "bundle_id": "analysis-fixture",
  "bundle_kind": "analysis",
  "status": "succeeded",
  "created_at": "2026-10-25T00:00:00Z",
  "files": [],
  "metadata": {
    "analysis_id": "A-fixture",
    "analysis_path": "analysis.json",
    "input_fingerprints": [
      "0000000000000000000000000000000000000000000000000000000000000000"
    ],
    "phases": [
      "fixture"
    ],
    "analyzer_identity": {}
  }
}
